<?xml version="1.0" encoding="UTF-8" ?>

<pipeline
  xmlns:xsi="http://www.w3.org/2001/XMLSchema-instance"
  xmlns="PipelineNamespace"
  xsi:schemaLocation="PipelineNamespace Pandora.pipeline.xsd">

  <enable>1</enable>
  <name>any</name>
  <id>0</id>
  <supported_usecase>
    <usecase>preview</usecase>
    <usecase>video</usecase>
  </supported_usecase>
  <process_order>fixed</process_order>

  <algorithms>
    <algorithm>
      <enable>1</enable>
      <name>PortraitVirtual</name>
      <author>360ai</author>
      <version>1</version>
      <sequence>0</sequence>
      <algorithm_type>algorithm</algorithm_type>
    </algorithm>
    <algorithm>
      <enable>1</enable>
      <name>ImageRotate</name>
      <author>lenovo</author>
      <version>1</version>
      <sequence>1</sequence>
      <algorithm_type>algorithm</algorithm_type>
    </algorithm>
    <algorithm>
      <enable>1</enable>
      <name>PictureInPicture</name>
      <author>lenovo</author>
      <version>1</version>
      <sequence>5</sequence>
      <algorithm_type>algorithm</algorithm_type>
    </algorithm>
    <algorithm>
      <enable>1</enable>
      <name>facebeauty</name>
      <author>fotonation</author>
      <version>1</version>
      <sequence>6</sequence>
      <algorithm_type>algorithm</algorithm_type>
    </algorithm>
    <algorithm>
      <enable>1</enable>
      <name>autoframing</name>
      <author>morpho</author>
      <version>1</version>
      <sequence>8</sequence>
      <algorithm_type>algorithm</algorithm_type>
    </algorithm>
  </algorithms>

</pipeline>
